{
  "linked_schemas": [
    "environmental_observation-v1.0.0"
  ],
  "name": "Burning observation — Bukit, Bali",
  "description": "In the backyard of the house",
  "primary_url": "https://planetai.fab.city/bali/profiles/AQ_20260726_075201_351.json",
  "latitude": -8.8058304,
  "longitude": 115.1675568,
  "geolocation": {
    "lat": -8.8058304,
    "lon": 115.1675568
  },
  "locality": "Bukit",
  "region": "Bali",
  "country_name": "Indonesia",
  "country_iso_3166": "ID",
  "tags": [
    "air_quality",
    "environment",
    "community_report",
    "planet_ai",
    "burning",
    "source:whatsapp",
    "severity:medium",
    "bioregion:indo_pacific_coral_triangle",
    "bukit_pilot"
  ],
  "status": "active",
  "date_added": "2026-07-26T17:54:59.330404+00:00",
  "observation_type": "photo",
  "pollution_category": "burning",
  "ai_analysis": {
    "detected": true,
    "confidence": 0.8,
    "indicators": [
      "plume of smoke",
      "open burning activity",
      "residential setting"
    ],
    "description": "Smoke is rising from an open burning site in a residential area.",
    "severity": "medium",
    "model_version": "exo:gemma-4-e4b-it-6bit"
  },
  "data_source": "whatsapp",
  "planet_ai_node": "bali.fab.city",
  "bioregion": "indo_pacific_coral_triangle",
  "action_cycle": {
    "observation_timestamp": "2026-07-26T17:54:59.330404+00:00",
    "reported_timestamp": "2026-07-26T17:54:59.330404+00:00",
    "response_status": "reported"
  }
}