{
  "linked_schemas": [
    "environmental_observation-v1.0.0"
  ],
  "name": "None observation — Bali, Bali",
  "description": "Construction site burning trash",
  "primary_url": "https://planetai.fab.city/bali/profiles/AQ_20260713_145129_608.json",
  "latitude": -8.6615147,
  "longitude": 115.1616358,
  "geolocation": {
    "lat": -8.6615147,
    "lon": 115.1616358
  },
  "locality": "Bali",
  "region": "Bali",
  "country_name": "Indonesia",
  "country_iso_3166": "ID",
  "tags": [
    "air_quality",
    "environment",
    "community_report",
    "planet_ai",
    "source:whatsapp",
    "severity:low",
    "bioregion:indo_pacific_coral_triangle",
    "bukit_pilot"
  ],
  "status": "active",
  "date_added": "2026-07-13T14:52:11.975050+00:00",
  "observation_type": "photo",
  "pollution_category": "none",
  "ai_analysis": {
    "detected": false,
    "confidence": 0.9,
    "indicators": [
      "construction site",
      "nighttime lighting",
      "no visible smoke or dust"
    ],
    "description": "The image shows a construction site at night with no visible signs of air pollution.",
    "severity": "low",
    "model_version": "gemini:gemini-flash-lite-latest (fallback; primary openai down)"
  },
  "data_source": "whatsapp",
  "planet_ai_node": "bali.fab.city",
  "bioregion": "indo_pacific_coral_triangle",
  "action_cycle": {
    "observation_timestamp": "2026-07-13T14:52:11.975050+00:00",
    "reported_timestamp": "2026-07-13T14:52:11.975050+00:00",
    "response_status": "reported"
  }
}