{
  "linked_schemas": [
    "environmental_observation-v1.0.0"
  ],
  "name": "Burning observation — Bali, Bali",
  "description": "Looks like residential rubbish burning next to river next to karaoke bar",
  "primary_url": "https://planetai.fab.city/bali/profiles/AQ_20260808_005253_677.json",
  "latitude": -8.6551839,
  "longitude": 115.1645453,
  "geolocation": {
    "lat": -8.6551839,
    "lon": 115.1645453
  },
  "locality": "Bali",
  "region": "Bali",
  "country_name": "Indonesia",
  "country_iso_3166": "ID",
  "tags": [
    "air_quality",
    "environment",
    "community_report",
    "planet_ai",
    "burning",
    "source:whatsapp",
    "severity:medium",
    "bioregion:indo_pacific_coral_triangle",
    "bukit_pilot"
  ],
  "status": "active",
  "date_added": "2026-08-08T00:54:14.389815+00:00",
  "observation_type": "photo",
  "pollution_category": "burning",
  "ai_analysis": {
    "detected": true,
    "confidence": 0.9,
    "indicators": [
      "smoke plume",
      "localized smoke",
      "thatched roof"
    ],
    "description": "Smoke is visible rising from a structure in the midground.",
    "severity": "medium",
    "model_version": "exo:gemma-4-e4b-it-6bit"
  },
  "data_source": "whatsapp",
  "planet_ai_node": "bali.fab.city",
  "bioregion": "indo_pacific_coral_triangle",
  "action_cycle": {
    "observation_timestamp": "2026-08-08T00:54:14.389815+00:00",
    "reported_timestamp": "2026-08-08T00:54:14.389815+00:00",
    "response_status": "reported"
  }
}