{
  "linked_schemas": [
    "environmental_observation-v1.0.0"
  ],
  "name": "Trash observation — Bukit, Bali",
  "description": "",
  "primary_url": "https://planetai.fab.city/bali/profiles/AQ_20260531_090515_280.json",
  "latitude": -8.7910167,
  "longitude": 115.1444969,
  "geolocation": {
    "lat": -8.7910167,
    "lon": 115.1444969
  },
  "locality": "Bukit",
  "region": "Bali",
  "country_name": "Indonesia",
  "country_iso_3166": "ID",
  "tags": [
    "air_quality",
    "environment",
    "community_report",
    "planet_ai",
    "trash",
    "source:whatsapp",
    "severity:low",
    "bioregion:indo_pacific_coral_triangle",
    "bukit_pilot"
  ],
  "status": "active",
  "date_added": "2026-05-31T09:05:22.669145+00:00",
  "observation_type": "photo",
  "pollution_category": "trash",
  "ai_analysis": {
    "detected": true,
    "confidence": 0.9,
    "indicators": [
      "discarded plastic bottle",
      "scattered litter",
      "dry grassy ground"
    ],
    "description": "The scene shows scattered trash and litter on a patch of dry grass.",
    "severity": "low",
    "model_version": "exo:gemma-4-e4b-it-6bit"
  },
  "data_source": "whatsapp",
  "planet_ai_node": "bali.fab.city",
  "bioregion": "indo_pacific_coral_triangle",
  "action_cycle": {
    "observation_timestamp": "2026-05-31T09:05:22.669145+00:00",
    "reported_timestamp": "2026-05-31T09:05:22.669145+00:00",
    "response_status": "reported"
  }
}