{
  "linked_schemas": [
    "environmental_observation-v1.0.0"
  ],
  "name": "None observation — Bali, Bali",
  "description": "Local house burning rubbish at the front of the house, local man sitting by the burning pile",
  "primary_url": "https://planetai.fab.city/bali/profiles/AQ_20260808_032048_677.json",
  "latitude": -8.6499402,
  "longitude": 115.1695674,
  "geolocation": {
    "lat": -8.6499402,
    "lon": 115.1695674
  },
  "locality": "Bali",
  "region": "Bali",
  "country_name": "Indonesia",
  "country_iso_3166": "ID",
  "tags": [
    "air_quality",
    "environment",
    "community_report",
    "planet_ai",
    "source:whatsapp",
    "severity:low",
    "bioregion:indo_pacific_coral_triangle",
    "bukit_pilot"
  ],
  "status": "active",
  "date_added": "2026-08-08T03:21:40.101842+00:00",
  "observation_type": "photo",
  "pollution_category": "none",
  "ai_analysis": {
    "detected": false,
    "confidence": 1.0,
    "indicators": [
      "stacked debris",
      "metal gate",
      "concrete wall"
    ],
    "description": "A pile of debris is visible behind a metal gate against a concrete wall.",
    "severity": "low",
    "model_version": "exo:gemma-4-e4b-it-6bit"
  },
  "data_source": "whatsapp",
  "planet_ai_node": "bali.fab.city",
  "bioregion": "indo_pacific_coral_triangle",
  "action_cycle": {
    "observation_timestamp": "2026-08-08T03:21:40.101842+00:00",
    "reported_timestamp": "2026-08-08T03:21:40.101842+00:00",
    "response_status": "reported"
  }
}