{
  "linked_schemas": [
    "environmental_observation-v1.0.0"
  ],
  "name": "Burning observation — Bali, Bali",
  "description": "On the beach",
  "primary_url": "https://planetai.fab.city/bali/profiles/AQ_20260603_060244_010.json",
  "latitude": -8.669461,
  "longitude": 115.141429,
  "geolocation": {
    "lat": -8.669461,
    "lon": 115.141429
  },
  "locality": "Bali",
  "region": "Bali",
  "country_name": "Indonesia",
  "country_iso_3166": "ID",
  "tags": [
    "air_quality",
    "environment",
    "community_report",
    "planet_ai",
    "burning",
    "source:whatsapp",
    "severity:medium",
    "bioregion:indo_pacific_coral_triangle",
    "bukit_pilot"
  ],
  "status": "active",
  "date_added": "2026-06-03T06:05:50.572082+00:00",
  "observation_type": "photo",
  "pollution_category": "burning",
  "ai_analysis": {
    "detected": true,
    "confidence": 0.95,
    "indicators": [
      "open fire",
      "burning debris",
      "smoke"
    ],
    "description": "Trash is burning on the beach during sunset.",
    "severity": "medium",
    "model_version": "exo:gemma-4-e4b-it-6bit"
  },
  "data_source": "whatsapp",
  "planet_ai_node": "bali.fab.city",
  "bioregion": "indo_pacific_coral_triangle",
  "action_cycle": {
    "observation_timestamp": "2026-06-03T06:05:50.572082+00:00",
    "reported_timestamp": "2026-06-03T06:05:50.572082+00:00",
    "response_status": "reported"
  }
}