{
  "linked_schemas": [
    "environmental_observation-v1.0.0"
  ],
  "name": "Burning observation — Bukit, Bali",
  "description": "Next to Bali kencana",
  "primary_url": "https://planetai.fab.city/bali/profiles/AQ_20260725_011628_016.json",
  "latitude": -8.8185348,
  "longitude": 115.1667556,
  "geolocation": {
    "lat": -8.8185348,
    "lon": 115.1667556
  },
  "locality": "Bukit",
  "region": "Bali",
  "country_name": "Indonesia",
  "country_iso_3166": "ID",
  "tags": [
    "air_quality",
    "environment",
    "community_report",
    "planet_ai",
    "burning",
    "source:whatsapp",
    "severity:medium",
    "bioregion:indo_pacific_coral_triangle",
    "bukit_pilot"
  ],
  "status": "active",
  "date_added": "2026-07-25T01:17:41.548275+00:00",
  "observation_type": "photo",
  "pollution_category": "burning",
  "ai_analysis": {
    "detected": true,
    "confidence": 0.95,
    "indicators": [
      "smoke rising",
      "open burning",
      "pile of trash"
    ],
    "description": "A small fire is burning trash along a dirt road.",
    "severity": "medium",
    "model_version": "exo:gemma-4-e4b-it-6bit"
  },
  "data_source": "whatsapp",
  "planet_ai_node": "bali.fab.city",
  "bioregion": "indo_pacific_coral_triangle",
  "action_cycle": {
    "observation_timestamp": "2026-07-25T01:17:41.548275+00:00",
    "reported_timestamp": "2026-07-25T01:17:41.548275+00:00",
    "response_status": "reported"
  }
}