{
  "linked_schemas": [
    "environmental_observation-v1.0.0"
  ],
  "name": "Burning observation — Kerobokan, Bali",
  "description": "Rubbish burning in Kerobokan off Jalan Raya Semer, next to residential building, behind the school",
  "primary_url": "https://planetai.fab.city/bali/profiles/AQ_20260801_011651_877.json",
  "latitude": -8.6561525,
  "longitude": 115.1640307,
  "geolocation": {
    "lat": -8.6561525,
    "lon": 115.1640307
  },
  "locality": "Kerobokan",
  "region": "Bali",
  "country_name": "Indonesia",
  "country_iso_3166": "ID",
  "tags": [
    "air_quality",
    "environment",
    "community_report",
    "planet_ai",
    "burning",
    "source:whatsapp",
    "severity:medium",
    "bioregion:indo_pacific_coral_triangle",
    "bukit_pilot"
  ],
  "status": "active",
  "date_added": "2026-08-01T01:18:39.634327+00:00",
  "observation_type": "photo",
  "pollution_category": "burning",
  "ai_analysis": {
    "detected": true,
    "confidence": 0.9,
    "indicators": [
      "localized smoke plume",
      "smoke rising from ground"
    ],
    "description": "Smoke is visible rising from the ground near the buildings.",
    "severity": "medium",
    "model_version": "exo:gemma-4-e4b-it-6bit"
  },
  "data_source": "whatsapp",
  "planet_ai_node": "bali.fab.city",
  "bioregion": "indo_pacific_coral_triangle",
  "action_cycle": {
    "observation_timestamp": "2026-08-01T01:18:39.634327+00:00",
    "reported_timestamp": "2026-08-01T01:18:39.634327+00:00",
    "response_status": "reported"
  }
}