{
  "linked_schemas": [
    "environmental_observation-v1.0.0"
  ],
  "name": "None observation — Bali, Bali",
  "description": "Rubbish burning in side of river behind the bush I couldn’t get a clear picture because there were people around",
  "primary_url": "https://planetai.fab.city/bali/profiles/AQ_20260808_031931_758.json",
  "latitude": -8.6512684,
  "longitude": 115.1697924,
  "geolocation": {
    "lat": -8.6512684,
    "lon": 115.1697924
  },
  "locality": "Bali",
  "region": "Bali",
  "country_name": "Indonesia",
  "country_iso_3166": "ID",
  "tags": [
    "air_quality",
    "environment",
    "community_report",
    "planet_ai",
    "source:whatsapp",
    "severity:low",
    "bioregion:indo_pacific_coral_triangle",
    "bukit_pilot"
  ],
  "status": "active",
  "date_added": "2026-08-08T03:20:27.603785+00:00",
  "observation_type": "photo",
  "pollution_category": "none",
  "ai_analysis": {
    "detected": false,
    "confidence": 1.0,
    "indicators": [
      "dense foliage",
      "water feature",
      "concrete structure"
    ],
    "description": "A landscaped area featuring a pond and dense bamboo.",
    "severity": "low",
    "model_version": "exo:gemma-4-e4b-it-6bit"
  },
  "data_source": "whatsapp",
  "planet_ai_node": "bali.fab.city",
  "bioregion": "indo_pacific_coral_triangle",
  "action_cycle": {
    "observation_timestamp": "2026-08-08T03:20:27.603785+00:00",
    "reported_timestamp": "2026-08-08T03:20:27.603785+00:00",
    "response_status": "reported"
  }
}