{
  "linked_schemas": [
    "environmental_observation-v1.0.0"
  ],
  "name": "Burning observation — Bali, Bali",
  "description": "Construction site burning trash",
  "primary_url": "https://planetai.fab.city/bali/profiles/AQ_20260715_122349_169.json",
  "latitude": -8.6615147,
  "longitude": 115.1616358,
  "geolocation": {
    "lat": -8.6615147,
    "lon": 115.1616358
  },
  "locality": "Bali",
  "region": "Bali",
  "country_name": "Indonesia",
  "country_iso_3166": "ID",
  "tags": [
    "air_quality",
    "environment",
    "community_report",
    "planet_ai",
    "burning",
    "source:whatsapp",
    "severity:medium",
    "bioregion:indo_pacific_coral_triangle",
    "bukit_pilot"
  ],
  "status": "active",
  "date_added": "2026-07-15T12:24:34.364193+00:00",
  "observation_type": "photo",
  "pollution_category": "burning",
  "ai_analysis": {
    "detected": true,
    "confidence": 0.95,
    "indicators": [
      "orange glow",
      "visible flames",
      "smoke/haze",
      "open fire"
    ],
    "description": "Open burning of material is visible beneath structures at night.",
    "severity": "medium",
    "model_version": "exo:gemma-4-e4b-it-6bit"
  },
  "data_source": "whatsapp",
  "planet_ai_node": "bali.fab.city",
  "bioregion": "indo_pacific_coral_triangle",
  "action_cycle": {
    "observation_timestamp": "2026-07-15T12:24:34.364193+00:00",
    "reported_timestamp": "2026-07-15T12:24:34.364193+00:00",
    "response_status": "reported"
  }
}