{
  "linked_schemas": [
    "environmental_observation-v1.0.0"
  ],
  "name": "Burning observation — Bukit, Bali",
  "description": "Yes",
  "primary_url": "https://planetai.fab.city/bali/profiles/AQ_20260610_083800_787.json",
  "latitude": -8.8259641,
  "longitude": 115.1504473,
  "geolocation": {
    "lat": -8.8259641,
    "lon": 115.1504473
  },
  "locality": "Bukit",
  "region": "Bali",
  "country_name": "Indonesia",
  "country_iso_3166": "ID",
  "tags": [
    "air_quality",
    "environment",
    "community_report",
    "planet_ai",
    "burning",
    "source:whatsapp",
    "severity:medium",
    "bioregion:indo_pacific_coral_triangle",
    "bukit_pilot"
  ],
  "status": "active",
  "date_added": "2026-06-10T08:38:37.261871+00:00",
  "observation_type": "photo",
  "pollution_category": "burning",
  "ai_analysis": {
    "detected": true,
    "confidence": 0.9,
    "indicators": [
      "smoke rising",
      "open burning area",
      "dry ground debris"
    ],
    "description": "A cow stands near an area of smoke and debris in a dry outdoor setting.",
    "severity": "medium",
    "model_version": "exo:gemma-4-e4b-it-6bit"
  },
  "data_source": "whatsapp",
  "planet_ai_node": "bali.fab.city",
  "bioregion": "indo_pacific_coral_triangle",
  "action_cycle": {
    "observation_timestamp": "2026-06-10T08:38:37.261871+00:00",
    "reported_timestamp": "2026-06-10T08:38:37.261871+00:00",
    "response_status": "reported"
  }
}