{
  "linked_schemas": [
    "environmental_observation-v1.0.0"
  ],
  "name": "Burning observation — Bali, Bali",
  "description": "Burning organic waste and plastic on the side of river",
  "primary_url": "https://planetai.fab.city/bali/profiles/AQ_20260808_031755_646.json",
  "latitude": -8.6523241,
  "longitude": 115.1704009,
  "geolocation": {
    "lat": -8.6523241,
    "lon": 115.1704009
  },
  "locality": "Bali",
  "region": "Bali",
  "country_name": "Indonesia",
  "country_iso_3166": "ID",
  "tags": [
    "air_quality",
    "environment",
    "community_report",
    "planet_ai",
    "burning",
    "source:whatsapp",
    "severity:medium",
    "bioregion:indo_pacific_coral_triangle",
    "bukit_pilot"
  ],
  "status": "active",
  "date_added": "2026-08-08T03:19:12.224764+00:00",
  "observation_type": "photo",
  "pollution_category": "burning",
  "ai_analysis": {
    "detected": true,
    "confidence": 0.95,
    "indicators": [
      "smoke rising",
      "burning trash",
      "trash pile"
    ],
    "description": "Smoke is rising from a pile of trash located near the base of a tree next to a drainage canal.",
    "severity": "medium",
    "model_version": "exo:gemma-4-e4b-it-6bit"
  },
  "data_source": "whatsapp",
  "planet_ai_node": "bali.fab.city",
  "bioregion": "indo_pacific_coral_triangle",
  "action_cycle": {
    "observation_timestamp": "2026-08-08T03:19:12.224764+00:00",
    "reported_timestamp": "2026-08-08T03:19:12.224764+00:00",
    "response_status": "reported"
  }
}